{
  "$schema": "./candidate.schema.json",
  "id": "solhint-mcp",
  "manifestId": "solhint",
  "stage": "lint",
  "install": {
    "type": "npm",
    "package": "solhint-mcp",
    "version": "0.1.6",
    "integrity": "sha512-/PmlMOj6glOq6+2a9Er9Suygnld+63S3aq3XphNxpMFFrVwMtTXYN7OJ+FWKWZS9MhSt2T59GXPy0ovOr374bw==",
    "bin": "solhint-mcp"
  },
  "transport": "stdio",
  "args": [],
  "network": "none",
  "requiresBinaries": [],
  "deniedTools": []
}
